{
  "schemaVersion": 1,
  "timezone": "America/Chicago",
  "defaultSchedule": {
    "weekday": "WEDNESDAY",
    "time": "19:00"
  },
  "override": null,
  "nextDropAt": "2026-10-08T00:00:00.000Z",
  "status": "armed",
  "updatedAt": "2026-10-01T12:45:32.000Z",
  "lastPublishedAt": "2026-10-01T12:45:32.000Z"
}
